Area,Topic,Type,Title,Text,Link5,  Data Enrichment,Paper,Uncertainty Visualization Using Copula-Based Analysis in Mixed Distribution Models,"Distributions are often used to model uncertainty in many scientific datasets. To preserve the correlation among thespatially sampled grid locations in the dataset, various standard multivariate distribution models have been proposed in visualizationliterature. These models treat each grid location as a univariate random variable which models the uncertainty at that location. Standardmultivariate distributions (both parametric and nonparametric) assume that all the univariate marginals are of the same type/family ofdistribution. But in reality, different grid locations show different statistical behavior which may not be modeled best by the same type ofdistribution. In this paper, we propose a new multivariate uncertainty modeling strategy to address the needs of uncertainty modelingin scientific datasets. Our proposed method is based on a statistically sound multivariate technique calledCopula, which makes itpossible to separate the process of estimating the univariate marginals and the process of modeling dependency, unlike the standardmultivariate distributions. The modeling flexibility offered by our proposed method makes it possible to design distribution fields whichcan have different types of distribution (Gaussian, Histogram, KDE etc.) at the grid locations, while maintaining the correlation structureat the same time. Depending on the results of various standard statistical tests, we can choose an optimal distribution representation ateach location, resulting in a more cost efficient modeling without significantly sacrificing on the analysis quality. To demonstrate theefficacy of our proposed modeling strategy, we extract and visualize uncertain features like isocontours and vortices in various realworld datasets. We also study various modeling criterion to help users in the task of univariate model selection.",https://subhashis.github.io/papers/copula-2018.pdf5,  Mathematical Frameworks for Data Transformation,Paper,On the Treatment of Field Quantities and Elemental Continuity in FEM Solutions.,"As the finite element method (FEM) and the finite volume method (FVM), both traditional and high-order variants, continue their proliferation into various applied engineering disciplines, it is important that the visualization techniques and corresponding data analysis tools that act on the results produced by these methods faithfully represent the underlying data. To state this in another way: the interpretation of data generated by simulation needs to be consistent with the numerical schemes that underpin the specific solver technology. As the verifiable visualization literature has demonstrated: visual artifacts produced by the introduction of either explicit or implicit data transformations, such as data resampling, can sometimes distort or even obfuscate key scientific features in the data. In this paper, we focus on the handling of elemental continuity, which is often only continuous or piecewise discontinuous, when visualizing primary or derived fields from FEM or FVM simulations. We demonstrate that traditional data handling and visualization of these fields introduce visual errors. In addition, we show how the use of the recently proposed line-SIAC filter provides a way of handling elemental continuity issues in an accuracy-conserving manner with the added benefit of casting the data in a smooth context even if the representation is element discontinuous.",https://pubmed.ncbi.nlm.nih.gov/28866517/5,  Technical Discourses on Data Processing and Management in Visualization,Paper,Rotation Invariant Vortices for Flow Visualization,"We propose a new class of vortex definitions for flows that are induced by rotating mechanical parts, such as stirring devices, helicopters, hydrocyclones, centrifugal pumps, or ventilators. Instead of a Galilean invariance, we enforce a rotation invariance, i.e., the invariance of a vortex under a uniform-speed rotation of the underlying coordinate system around a fixed axis. We provide a general approach to transform a Galilean invariant vortex concept to a rotation invariant one by simply adding a closed form matrix to the Jacobian. In particular, we present rotation invariant versions of the well-known Sujudi-Haimes, Lambda-2, and Q vortex criteria. We apply them to a number of artificial and real rotating flows, showing that for these cases rotation invariant vortices give better results than their Galilean invariant counterparts.",https://pubmed.ncbi.nlm.nih.gov/26390472/6,Area 6,Description,,"This area focuses on the design and optimization of integrated workflows for visual data analysis, knowledge discovery, decision support, machine learning, and other data intelligence tasks. It typically addresses technical problems that cannot be solved using solely machine-centric processes (e.g., statistics and algorithms) or solely human-centric processes (e.g., visualization and interaction). It may also address the need for using interactive visualization to improve the trust, interpretability, understanding of machine-centric processes and their underlying models and need for data intelligence workflows to benefit from theoretical models and empirical findings in cognition, e.g., in areas such as distributed, embodied, and enactive cognition. Hence papers submitted to this area are normally expected to feature an integrated approach. This area includes visualizations and visual analytic tools that show these models, or leverage them heavily for producing the visualization.",6,"  Integrated Workflows for Information Seeking, Knowledge Discovery, and Decision Making",Description,,"Typical technical problems may include information retrieval, multivariate and semantic search; classification, pattern recognition and clustering; similarity, correlation and causality analysis; spatiotemporal tracking and movement analysis; event and sequence analysis; multimedia data analysis; anomaly and change detection; relationship, association, hierarchy, network and structure analysis; intention and behavior analysis; factor analysis and dimensionality reduction; uncertainty and risk analysis; and so on.",6,  Integrated Workflows for Machine Learning,Description,,"Typical technical problems may include cleaning and labelling training data; assisting active learning or other semi-automated learning methods; facilitating model testing, evaluation and model comparison; supporting the analysis of learned models and learning processes; enabling model understanding, explanation, refinement, and steering; and monitoring the deployment of machine-learned models as well as other machine-centric processes.",6,  Workflow Optimization,Description,,"techniques, design patterns, and best practices for designing, developing, evaluating, and improving integrated data intelligence workflows. Methods for analysing and alleviating data biases, machine biases, and human biases.",6,  Knowledge-assisted Workflows,Description,,"knowledge acquisition, mixed-initiative workflows, real-time guidance and recommendation, provenance management and utilization, post-action review, knowledge sharing, and analyst training in visual data analysis.",6,"  Integrated Workflows for Information Seeking, Knowledge Discovery, and Decision Making",Paper,TPFlow: Progressive Partition and Multidimensional Pattern Extraction for Large-Scale Spatio-Temporal Data Analysis.,"Consider a multi-dimensional spatio-temporal (ST) dataset where each entry is a numerical measure defined by the corresponding temporal, spatial and other domain-specific dimensions. A typical approach to explore such data utilizes interactive visualizations with multiple coordinated views. Each view displays the aggregated measures along one or two dimensions. By brushing on the views, analysts can obtain detailed information. However, this approach often cannot provide sufficient guidance for analysts to identify patterns hidden within subsets of data. Without a priori hypotheses, analysts need to manually select and iterate through different slices to search for patterns, which can be a tedious and lengthy process. In this work, we model multidimensional ST data as tensors and propose a novel piecewise rank-one tensor decomposition algorithm which supports automatically slicing the data into homogeneous partitions and extracting the latent patterns in each partition for comparison and visual summarization. The algorithm optimizes a quantitative measure about how faithfully the extracted patterns visually represent the original data. Based on the algorithm we further propose a visual analytics framework that supports a top-down, progressive partitioning workflow for level-of-detail multidimensional ST data exploration. We demonstrate the general applicability and effectiveness of our technique on three datasets from different application domains: regional sales trend analysis, customer traffic analysis in department stores, and taxi trip analysis with origin-destination (OD) data. We further interview domain experts to verify the usability of the prototype.",https://pubmed.ncbi.nlm.nih.gov/30136965/6,"  Integrated Workflows for Information Seeking, Knowledge Discovery, and Decision Making",Paper,A Visual Analytics Approach for Categorical Joint Distribution Reconstruction from Marginal Projections,"Oftentimes multivariate data are not available as sets of equally multivariate tuples, but only as sets of projections into subspaces spanned by subsets of these attributes. For example, one may find data with five attributes stored in six tables of two attributes each, instead of a single table of five attributes. This prohibits the visualization of these data with standard high-dimensional methods, such as parallel coordinates or MDS, and there is hence the need to reconstruct the full multivariate (joint) distribution from these marginal ones. Most of the existing methods designed for this purpose use an iterative procedure to estimate the joint distribution. With insufficient marginal distributions and domain knowledge, they lead to results whose joint errors can be large. Moreover, enforcing smoothness for regularizations in the joint space is not applicable if the attributes are not numerical but categorical. We propose a visual analytics approach that integrates both anecdotal data and human experts to iteratively narrow down a large set of plausible solutions. The solution space is populated using a Monte Carlo procedure which uniformly samples the solution space. A level-of-detail high dimensional visualization system helps the user understand the patterns and the uncertainties. Constraints that narrow the solution space can then be added by the user interactively during the iterative exploration, and eventually a subset of solutions with narrow uncertainty intervals emerges.",https://pubmed.ncbi.nlm.nih.gov/27514059/6,  Integrated Workflows for Machine Learning,Paper,Visualizing Dataflow Graphs of Deep Learning Models in TensorFlow,"We present a design study of the TensorFlow Graph Visualizer, part of the TensorFlow machine intelligence platform. This tool helps users understand complex machine learning architectures by visualizing their underlying dataflow graphs. The tool works by applying a series of graph transformations that enable standard layout techniques to produce a legible interactive diagram. To declutter the graph, we decouple non-critical nodes from the layout. To provide an overview, we build a clustered graph using the hierarchical structure annotated in the source code. To support exploration of nested structure on demand, we perform edge bundling to enable stable and responsive cluster expansion. Finally, we detect and highlight repeated structures to emphasize a model's modular composition. To demonstrate the utility of the visualizer, we describe example usage scenarios and report user feedback. Overall, users find the visualizer useful for understanding, debugging, and sharing the structures of their models.",https://pubmed.ncbi.nlm.nih.gov/28866562/6,  Integrated Workflows for Machine Learning,Paper,Supporting Analysis of Dimensionality Reduction Results with Contrastive Learning,"Dimensionality reduction (DR) is frequently used for analyzing and visualizing high-dimensional data as it provides agood first glance of the data. However, to interpret the DR result for gaining useful insights from the data, it would take additionalanalysis effort such as identifying clusters and understanding their characteristics. While there are many automatic methods (e.g.,density-based clustering methods) to identify clusters, effective methods for understanding a cluster’s characteristics are still lacking. Acluster can be mostly characterized by its distribution of feature values. Reviewing the original feature values is not a straightforwardtask when the number of features is large. To address this challenge, we present a visual analytics method that effectively highlightsthe essential features of a cluster in a DR result. To extract the essential features, we introduce an enhanced usage of contrastiveprincipal component analysis (cPCA). Our method, called ccPCA (contrasting clusters in PCA), can calculate each feature’s relativecontribution to thecontrastbetween one cluster and other clusters. With ccPCA, we have created an interactive system including ascalable visualization of clusters’ feature contributions. We demonstrate the effectiveness of our method and system with case studiesusing several publicly available datasets.",https://arxiv.org/pdf/1905.03911.pdf6,  Workflow Optimization,Paper,Analysis of Flight Variability: a Systematic Approach,"In movement data analysis, there exists a problem of comparing multiple trajectories of moving objects to common ordistinct reference trajectories. We introduce a general conceptual framework for comparative analysis of trajectories and an analyticalprocedure, which consists of (1) finding corresponding points in pairs of trajectories, (2) computation of pairwise difference measures,and (3) interactive visual analysis of the distributions of the differences with respect to space, time, set of moving objects, trajectorystructures, and spatio-temporal context. We propose a combination of visualisation, interaction, and data transformation techniquessupporting the analysis and demonstrate the use of our approach for solving a challenging problem from the aviation domain.",http://geoanalytics.net/and/papers/vast18.pdf6,  Workflow Optimization,Paper,PlanningVis: A Visual Analytics Approach to Production Planning in Smart Factories,"Production planning in the manufacturing industry is crucial for fully utilizing factory resources (e.g., machines, raw materials and workers) and reducing costs. With the advent of industry 4.0, plenty of data recording the status of factory resources have been collected and further involved in production planning, which brings an unprecedented opportunity to understand, evaluate and adjust complex production plans through a data-driven approach. However, developing a systematic analytics approach for production planning is challenging due to the large volume of production data, the complex dependency between products, and unexpected changes in the market and the plant. Previous studies only provide summarized results and fail to show details for comparative analysis of production plans. Besides, the rapid adjustment to the plan in the case of an unanticipated incident is also not supported. In this paper, we propose PlanningVis, a visual analytics system to support the exploration and comparison of production plans with three levels of details: a plan overview presenting the overall difference between plans, a product view visualizing various properties of individual products, and a production detail view displaying the product dependency and the daily production details in related factories. By integrating an automatic planning algorithm with interactive visual explorations, PlanningVis can facilitate the efficient optimization of daily production planning as well as support a quick response to unanticipated incidents in manufacturing. Two case studies with real-world data and carefully designed interviews with domain experts demonstrate the effectiveness and usability of PlanningVis.",https://pubmed.ncbi.nlm.nih.gov/31425087/6,  Knowledge-assisted Workflows,Paper,Clustrophile 2: Guided Visual Clustering Analysis,"Data clustering is a common unsupervised learning method frequently used in exploratory data analysis. However, identifyingrelevant structures in unlabeled, high-dimensional data is nontrivial, requiring iterative experimentation with clustering parameters aswell as data features and instances. The number of possible clusterings for a typical dataset is vast, and navigating in this vast space isalso challenging. The absence of ground-truth labels makes it impossible to define an optimal solution, thus requiring user judgment toestablish what can be considered a satisfiable clustering result. Data scientists need adequate interactive tools to effectively explore andnavigate the large clustering space so as to improve the effectiveness of exploratory clustering analysis. We introduceClustrophile 2,a new interactive tool for guided clustering analysis.Clustrophile 2guides users in clustering-based exploratory analysis, adaptsuser feedback to improve user guidance, facilitates the interpretation of clusters, and helps quickly reason about differences betweenclusterings. To this end,Clustrophile 2contributes a novel feature, the Clustering Tour, to help users choose clustering parameters andassess the quality of different clustering results in relation to current analysis goals and user expectations. We evaluateClustrophile 2through a user study with 12 data scientists, who used our tool to explore and interpret sub-cohorts in a dataset of Parkinson’s diseasepatients. Results suggest thatClustrophile 2improves the speed and effectiveness of exploratory clustering analysis for both experts andnon-experts.",https://arxiv.org/pdf/1804.03048.pdf6,  Knowledge-assisted Workflows,Paper,KnowledgePearls: Provenance-Based Visualization Retrieval.,"Storing analytical provenance generates a knowledge base with a large potential for recalling previous results and guidingusers in future analyses. However, without extensive manual creation of meta information and annotations by the users, search andretrieval of analysis states can become tedious. We presentKnowledgePearls, a solution for efficient retrieval of analysis states thatare structured as provenance graphs containing automatically recorded user interactions and visualizations. As a core component, wedescribe a visual interface for querying and exploring analysis states based on their similarity to a partial definition of a requestedanalysis state. Depending on the use case, this definition may be provided explicitly by the user by formulating a search query orinferred from given reference states. We explain our approach using the example of efficient retrieval of demographic analyses byHans Rosling and discuss our implementation for a fast look-up of previous states. Our approach is independent of the underlyingvisualization framework. We discuss the applicability for visualizations which are based on the declarative grammarVegaand we usea Vega-based implementation ofGapminderas guiding example. We additionally present a biomedical case study to illustrate howKnowledgePearlsfacilitates the exploration process by recalling states from earlier analyses.",http://data.caleydo.org/papers/2018_vast_knowledge-pearls.pdf6,  Knowledge-assisted Workflows,Paper,"Exploring Multivariate Event Sequences using Rules, Aggregations, and Selections","Multivariate event sequences are ubiquitous: travel history, telecommunication conversations, and server logs are someexamples. Besides standard properties such as type and timestamp, events often have other associated multivariate data. Currentexploration and analysis methods either focus on the temporal analysis of a single attribute or the structural analysis of the multivariatedata only. We present an approach where users can explore event sequences at multivariate and sequential level simultaneously byinteractively defining a set of rewrite rules using multivariate regular expressions. Users can store resulting patterns as new types ofevents or attributes to interactively enrich or simplify event sequences for further investigation. In Eventpad we provide a bottom-upglyph-oriented approach for multivariate event sequence analysis by searching, clustering, and aligning them according to newly defineddomain specific properties. We illustrate the effectiveness of our approach with real-world data sets including telecommunication trafficand hospital treatments.",https://www.bramcappers.nl/files/papers/eventPad.pdf