Area,Topic,Type,Title,Text,Link2,Insight,Paper,Bridging From Goals to Tasks with Design Study Analysis Reports,"Visualization researchers and practitioners engaged in generating or evaluating designs are faced with the difficult problemof transforming the questions asked and actions taken by target users from domain-specific language and context into more abstractforms. Existing abstract task classifications aim to provide support for this endeavour by providing a carefully delineated suite of actions.Our experience is that this bottom-up approach is part of the challenge: low-level actions are difficult to interpret without a higher-levelcontext of analysis goals and the analysis process. To bridge this gap, we propose a framework based on analysis reports derived fromopen-coding 20 design study papers published at IEEE InfoVis 2009-2015, to build on the previous work of abstractions that collectivelyencompass a broad variety of domains. The framework is organized in two axes illustrated by nine analysis goals. It helps situate theanalysis goals by placing each goal under axes of specificity (Explore, Describe, Explain, Confirm) and number of data populations(Single, Multiple). The single-population types are Discover Observation, Describe Observation, Identify Main Cause, and CollectEvidence. The multiple-population types are Compare Entities, Explain Differences, and Evaluate Hypothesis. Each analysis goal isscoped by an input and an output and is characterized by analysis steps reported in the design study papers. We provide examplesof how we and others have used the framework in a top-down approach to abstracting domain problems: visualization designers orresearchers first identify the analysis goals of each unit of analysis in an analysis stream, and then encode the individual steps usingexisting task classifications with the context of the goal, the level of specificity, and the number of populations involved in the analysis.",https://research.tableau.com/sites/default/files/GoalsToTasks.pdf3,Area 3,Description,,"This area focuses on the themes of building systems, algorithms for rendering, and alternate input and output modalities. Papers submitted to this area may present new visualization system architectures, support different computing platforms and development environments, or exploit commodity and specialized hardware devices for either rendering or interaction modalities beyond the desktop. The rendering theme includes algorithms and techniques both in software and through hardware acceleration, and also algorithms for graph layout and label placement.",3,  Computing Platforms,Description,,"commodity hardware, GPU, HPC, energy efficient visualization algorithms and hardware, etc.",3,  Visualization Environments,Description,,"non-immersive and immersive environments, desktop, mobile, web-based, VR/MR/AR, dome theaters, CAVEs, physicalization, remote collaboration, etc.",3,  Display Hardware and Output Devices,Description,,"large and small displays, stereo displays, volumetric displays, 2D/3D printing, non-visual devices, etc.",3,  Interaction Modalities,Description,,"touch, pen, speech, gesture, haptics, etc.",3,  Development Environments,Description,,"programming languages, software libraries, authoring systems, visualization toolkits, software frameworks for integration and interoperability, etc.",3,  Processing Paradigms,Description,,"parallel, distributed, out-of-core, progressive, streaming, in situ, in transit, etc.",3,  Engineering Visualization Systems,Description,,"visualization system lifecycle, testing, performance analysis, verification, validation, etc.",3,  Visualization Systems,Description,,"general-purpose and application-specific plug-ins, apps, tools, systems, multi-system workflows, etc.",3,  Data and Software Resources,Description,,"open data, open source software, benchmark data, reproducibility, authentication, etc.",3,  Rendering Techniques,Description,,"surface rendering, volume rendering, point-cloud rendering, line-cloud rendering, global illumination, stylized rendering, transfer functions, etc.",3,  Lighting and Shading Models,Description,,"volume rendering integrals, spectral rendering, learning lighting and shading models from real-world data.",3,  Placement Techniques,Description,,"object placement, graph layout, word/tag cloud, etc.",3,  Other Synthesis Techniques,Description,,"fabrication, sonification, haptic feedback, etc.",3,  Computing Platforms,Paper,Cross-Platform Ubiquitous Volume Rendering Using Programmable Shaders in VTK for Scientific and Medical Visualization,"The visualization toolkit (VTK) is a popular cross-platform, open source toolkit for scientific and medical data visualization, processing, and analysis. It supports a wide variety of data formats, algorithms, and rendering techniques for both polygonal and volumetric data. In particular, VTK's volume rendering module has long provided a comprehensive set of features such as plane clipping, color and opacity transfer functions, lighting, and other controls needed for visualization. However, due to VTK's legacy OpenGL backend and its reliance on a deprecated API, the system did not take advantage of the latest improvements in graphics hardware or the flexibility of a programmable pipeline. Additionally, this dependence on an antiquated pipeline posed restrictions when running on emerging computing platforms, thereby limiting its overall applicability. In response to these shortcomings, the VTK community developed a new and improved volume rendering module, which not only provides a modern graphics processing unit-based implementation, but also augments its capabilities with new features such as fast volume clipping, gradient-magnitude-based opacity modulation, render to texture, and hardware-based volume picking.",https://ieeexplore.ieee.org/document/86636503,  Visualization Environments,Paper,Designing for Mobile and Immersive Visual Analytics in the Field,"Data collection and analysis in the field is critical for operations in domains such as environmental science and public safety. However, field workers currently face data- and platform-oriented issues in efficient data collection and analysis in the field, such as limited connectivity, screen space, and attentional resources. In this paper, we explore how visual analytics tools might transform field practices by more deeply integrating data into these operations. We use a design probe coupling mobile, cloud and immersive analytics components to guide interviews with ten experts from five domains to explore how visual analytics could support data collection and analysis needs in the field. The results identify shortcomings of current approaches and target scenarios and design considerations for future field analysis systems. We embody these findings in FieldView, an extensible, open-source prototype designed to support critical use cases for situated field analysis. Our findings suggest the potential for integrating mobile and immersive technologies to enhance data's utility for various field operations and new directions for visual analytics tools to transform fieldwork.",https://arxiv.org/abs/1908.006803,"  M. Kraus, N. K. Weiler, D. Oelke, J. Kehrer, D. Keim, J. Fuchs. ""The Impact of Immersion on Cluster Identification Tasks"",  IEEE Transactions on Visualization and Computer Graphics, 26(1)",Paper,The Impact of Immersion on Cluster Identification Tasks,"Recent developments in technology encourage the use of head-mounted displays (HMDs) as a medium to explore visualizations in virtual realities (VRs). VR environments (VREs) enable new, more immersive visualization design spaces compared to traditional computer screens. Previous studies in different domains, such as medicine, psychology, and geology, report a positive effect of immersion, e.g., on learning performance or phobia treatment effectiveness. Our work presented in this paper assesses the applicability of those findings to a common task from the information visualization (InfoVis) domain. We conducted a quantitative user study to investigate the impact of immersion on cluster identification tasks in scatterplot visualizations. The main experiment was carried out with 18 participants in a within-subjects setting using four different visualizations, (1) a 2D scatterplot matrix on a screen, (2) a 3D scatterplot on a screen, (3) a 3D scatterplot miniature in a VRE and (4) a fully immersive 3D scatterplot in a VRE. The four visualization design spaces vary in their level of immersion, as shown in a supplementary study. The results of our main study indicate that task performance differs between the investigated visualization design spaces in terms of accuracy, efficiency, memorability, sense of orientation, and user preference. In particular, the 2D visualization on the screen performed worse compared to the 3D visualizations with regard to the measured variables. The study shows that an increased level of immersion can be a substantial benefit in the context of 3D data and cluster detection.",https://pubmed.ncbi.nlm.nih.gov/31536002/3,  Display Hardware and Output Devices,Paper,VisTiles: Coordinating and Combining Co-located Mobile Devices for Visual Data Exploration,"We presentVISTILES, a conceptual framework that uses a set of mobile devices to distribute and coordinate visualizationviews for the exploration of multivariate data. In contrast to desktop-based interfaces for information visualization, mobile devicesoffer the potential to provide a dynamic and user-defined interface supporting co-located collaborative data exploration with differentindividual workflows. As part of our framework, we contribute concepts that enable users to interact with coordinated & multiple views(CMV) that are distributed across several mobile devices. The major components of the framework are: (i)dynamic and flexible layoutsfor CMVfocusing on the distribution of views and (ii) an interaction concept forsmart adaptations and combinations of visualizationsutilizing explicit side-by-side arrangements of devices. As a result, users can benefit from the possibility to combine devices andorganize them in meaningful spatial layouts. Furthermore, we present a web-based prototype implementation as a specific instance ofour concepts. This implementation provides a practical application case enabling users to explore a multivariate data collection. Wealso illustrate the design process including feedback from a preliminary user study, which informed the design of both the concepts andthe final prototype.",https://imld.de/cnt/uploads/Langner_VisTiles_InfoVis17.pdf3,  Interaction Modalities,Paper,A Lightweight Tangible 3D Interface for Interactive Visualization of Thin Fiber Structures,"We present a prop-based, tangible interface for 3D interactive visualization of thin fiber structures. These data are com-monly found in current bioimaging datasets, for example second-harmonic generation microscopy of collagen fibers in tissue. Ourapproach uses commodity visualization technologies such as a depth sensing camera and low-cost 3D display. Unlike most currentuses of these emerging technologies in the games and graphics communities, we employ the depth sensing camera to create afish-tank stereoscopic virtual reality system at the scientist’s desk that supports tracking of small-scale gestures with objects alreadyfound in the work space. We apply the new interface to the problem of interactive exploratory visualization of three-dimensional thinfiber data. A critical task for the visual analysis of these data is understanding patterns in fiber orientation throughout a volume.Theinterface enables a new, fluid style of data exploration and fiber orientation analysis by using props to provide needed passive-hapticfeedback, making 3D interactions with these fiber structures more controlled. We also contribute a low-level algorithm for extractingfiber centerlines from volumetric imaging. The system was designed and evaluated with two biophotonic experts who currently use itin their lab. As compared to typical practice within their field, the new visualization system provides a more effective way to examineand understand the 3D bioimaging datasets they collect.",http://bret-jackson.com/papers/vis13-propbased-fiber-vis.pdf3,  Development Environments,Paper,Vega-lite: A grammar of interactive graphics,"We present Vega-Lite, a high-level grammar that enables rapid specification of interactive data visualizations. Vega-Lite combines a traditional grammar of graphics, providing visual encoding rules and a composition algebra for layered and multi-view displays, with a novel grammar of interaction. Users specify interactive semantics by composing selections. In Vega-Lite, a selection is an abstraction that defines input event processing, points of interest, and a predicate function for inclusion testing. Selections parameterize visual encodings by serving as input data, defining scale extents, or by driving conditional logic. The Vega-Lite compiler automatically synthesizes requisite data flow and event handling logic, which users can override for further customization. In contrast to existing reactive specifications, Vega-Lite selections decompose an interaction design into concise, enumerable semantic units. We evaluate Vega-Lite through a range of examples, demonstrating succinct specification of both customized interaction methods and common techniques such as panning, zooming, and linked selection.",https://pubmed.ncbi.nlm.nih.gov/27875150/3,  Processing Paradigms,Paper,VTK-m: Accelerating the Visualization Toolkit for Massively Threaded Architectures,"One of the most critical challenges for high-performance computing (HPC) scientific visualization is execution on massively threaded processors. Of the many fundamental changes we are seeing in HPC systems, one of the most profound is a reliance on new processor types optimized for execution bandwidth over latency hiding. Our current production scientific visualization software is not designed for these new types of architectures. To address this issue, the VTK-m framework serves as a container for algorithms, provides flexible data representation, and simplifies the design of visualization algorithms on new and future computer architecture.",http://www.sci.utah.edu/publications/Mor2016b/07466740.pdf3,  Engineering Visualization Systems,Paper,"Keeping Multiple Views Consistent: Constraints, Validations and Exceptions in Visualization Authoring","Visualizations often appear in multiples, either in a single display (e.g., small multiples, dashboard) or across time or space (e.g., slideshow, set of dashboards). However, existing visualization design guidelines typically focus on single rather than multiple views. Solely following these guidelines can lead to effective yet inconsistent views (e.g., the same field has different axes domains across charts), making interpretation slow and error-prone. Moreover, little is known how consistency balances with other design considerations, making it difficult to incorporate consistency mechanisms in visualization authoring software. We present a wizard-of-oz study in which we observed how Tableau users achieve and sacrifice consistency in an exploration-to-presentation visualization design scenario. We extend (from our prior work) a set of encoding-specific constraints defining consistency across multiple views. Using the constraints as a checklist in our study, we observed cases where participants spontaneously maintained consistent encodings and warned cases where consistency was overlooked. In response to the warnings, participants either revised views for consistency or stated why they thought consistency should be overwritten. We categorize participants' actions and responses as constraint validations and exceptions, depicting the relative importance of consistency and other design considerations under various circumstances (e.g., data cardinality, available encoding resources, chart layout). We discuss automatic consistency checking as a constraint-satisfaction problem and provide design implications for communicating inconsistencies to users.",https://ieeexplore.ieee.org/abstract/document/80176513,  Visualization Systems,Paper,OSPRay – A CPU Ray Tracing Framework for Scientific Visualization,"Scientific data is continually increasing in complexity, variety and size, making efficient visualization and specifically rendering an ongoing challenge. Traditional rasterization-based visualization approaches encounter performance and quality limitations, particularly in HPC environments without dedicated rendering hardware. In this paper, we present OSPRay, a turn-key CPU ray tracing framework oriented towards production-use scientific visualization which can utilize varying SIMD widths and multiple device backends found across diverse HPC resources. This framework provides a high-quality, efficient CPU-based solution for typical visualization workloads, which has already been integrated into several prevalent visualization packages. We show that this system delivers the performance, high-level API simplicity, and modular device support needed to provide a compelling new rendering framework for implementing efficient scientific visualization workflows.",https://ieeexplore.ieee.org/document/75395993,  Visualization Systems,Paper,Inviwo - A Visualization System with Usage Abstraction Levels,"The complexity of today's visualization applications demands specific visualization systems tailored for the development of these applications. Frequently, such systems utilize levels of abstraction to improve the application development process, for instance by providing a data flow network editor. Unfortunately, these abstractions result in several issues, which need to be circumvented through an abstraction-centered system design. Often, a high level of abstraction hides low level details, which makes it difficult to directly access the underlying computing platform, which would be important to achieve an optimal performance. Therefore, we propose a layer structure developed for modern and sustainable visualization systems allowing developers to interact with all contained abstraction levels. We refer to this interaction capabilities as usage abstraction levels, since we target application developers with various levels of experience. We formulate the requirements for such a system, derive the desired architecture, and present how the concepts have been exemplary realized within the Inviwo visualization system. Furthermore, we address several specific challenges that arise during the realization of such a layered architecture, such as communication between different computing platforms, performance centered encapsulation, as well as layer-independent development by supporting cross layer documentation and debugging capabilities.",https://ieeexplore.ieee.org/document/87305133,  Data and Software Resources,Paper,vispubdata.org: A Metadata Collection about IEEE Visualization (VIS) Publications,"We have created and made available to all a dataset with information about every paper that has appeared at the IEEE Visualization (VIS) set of conferences: InfoVis, SciVis, VAST, and Vis. The information about each paper includes its title, abstract, authors, and citations to other papers in the conference series, among many other attributes. This article describes the motivation for creating the dataset, as well as our process of coalescing and cleaning the data, and a set of three visualizations we created to facilitate exploration of the data. This data is meant to be useful to the broad data visualization community to help understand the evolution of the field and as an example document collection for text data visualization research.",https://ieeexplore.ieee.org/document/75837083,  Rendering Techniques,Paper,SparseLeap: Efficient Empty Space Skipping for Large-Scale Volume Rendering,"Recent advances in data acquisition produce volume data of very high resolution and large size, such as terabyte-sized microscopy volumes. These data often contain many fine and intricate structures, which pose huge challenges for volume rendering, and make it particularly important to efficiently skip empty space. This paper addresses two major challenges: (1) The complexity of large volumes containing fine structures often leads to highly fragmented space subdivisions that make empty regions hard to skip efficiently. (2) The classification of space into empty and non-empty regions changes frequently, because the user or the evaluation of an interactive query activate a different set of objects, which makes it unfeasible to pre-compute a well-adapted space subdivision. We describe the novel SparseLeap method for efficient empty space skipping in very large volumes, even around fine structures. The main performance characteristic of SparseLeap is that it moves the major cost of empty space skipping out of the ray-casting stage. We achieve this via a hybrid strategy that balances the computational load between determining empty ray segments in a rasterization (object-order) stage, and sampling non-empty volume data in the ray-casting (image-order) stage. Before ray-casting, we exploit the fast hardware rasterization of GPUs to create a ray segment list for each pixel, which identifies non-empty regions along the ray. The ray-casting stage then leaps over empty space without hierarchy traversal. Ray segment lists are created by rasterizing a set of fine-grained, view-independent bounding boxes. Frame coherence is exploited by re-using the same bounding boxes unless the set of active objects changes. We show that SparseLeap scales better to large, sparse data than standard octree empty space skipping.",https://pubmed.ncbi.nlm.nih.gov/28866532/3,  Lighting and Shading Models,Paper,Correlated Photon Mapping for Interactive Global Illumination of Time-Varying Volumetric Data,"We present a method for interactive global illumination of both static and time-varying volumetric data based on reduction of the overhead associated with re-computation of photon maps. Our method uses the identification of photon traces invariant to changes of visual parameters such as the transfer function (TF), or data changes between time-steps in a 4D volume. This lets us operate on a variant subset of the entire photon distribution. The amount of computation required in the two stages of the photon mapping process, namely tracing and gathering, can thus be reduced to the subset that are affected by a data or visual parameter change. We rely on two different types of information from the original data to identify the regions that have changed. A low resolution uniform grid containing the minimum and maximum data values of the original data is derived for each time step. Similarly, for two consecutive time-steps, a low resolution grid containing the difference between the overlapping data is used. We show that this compact metadata can be combined with the transfer function to identify the regions that have changed. Each photon traverses the low-resolution grid to identify if it can be directly transferred to the next photon distribution state or if it needs to be recomputed. An efficient representation of the photon distribution is presented leading to an order of magnitude improved performance of the raycasting step. The utility of the method is demonstrated in several examples that show visual fidelity, as well as performance. The examples show that visual quality can be retained when the fraction of retraced photons is as low as 40%-50%.",https://pubmed.ncbi.nlm.nih.gov/27514045/3,  Placement Techniques,Paper,Hola: Human-like orthogonal network layout,"Over the last 50 years a wide variety of automatic network layout algorithms have been developed. Some are fast heuristictechniques suitable for networks with hundreds of thousands of nodes while others are multi-stage frameworks for higher-quality layoutof smaller networks. However, despite decades of research currently no algorithm produces layout of comparable quality to that ofa human. We give a new “human-centred” methodology for automatic network layout algorithm design that is intended to overcomethis deficiency. User studies are first used to identify the aesthetic criteria algorithms should encode, then an algorithm is developedthat is informed by these criteria and finally, a follow-up study evaluates the algorithm output. We have used this new methodology todevelop an automatic orthogonal network layout method, HOLA, that achieves measurably better (by user study) layout than the bestavailable orthogonal layout algorithm and which produces layouts of comparable quality to those produced by hand.",https://ialab.it.monash.edu/~dwyer/papers/hola2015.pdf