Area,Topic,Type,Title,Text,Link1,Area 1,Description,,"This area focuses on theoretical and empirical research topics that aim to establish the foundation of VIS as a scientific subject. Theoretical work which aims to contribute to fundamental questions that relate to how we understand, assess, categorize, or formalize visualizations and/or visual analytics work. Empirical research aims to contribute research methodologies or concrete results of assessments of a visualization / visual analytics contribution or its context of use.",1,Concept Formulation,Description,,"surveys with organization, synthesis, and reflection; taxonomies and ontologies; guidelines and principles; lexica, syntaxes (grammars), semantics, pragmatics of visualization; and information security, privacy, ethics and professionalism in visualization.",1,Model Development,Description,,"conceptual models and simulation models for describing aspects of visualization processes (e.g., color perception, knowledge acquisition, collaborative decision making, etc.).",1,Mathematical Formalization,Description,,"mathematical frameworks, quality metrics, theorems (i.e., mathematically-defined causal relations in VIS).",1,Research Methodology,Description,,"general methodologies for conducting VIS research, e.g., typology, grounded theory, empirical studies, design studies, task analysis, user engagement, qualitative and quantitative research, etc.",1,Empirical Studies,Description,,"controlled (e.g., typical laboratory experiments), semi-controlled (e.g., typical crowdsourcing studies), and uncontrolled studies (e.g., small group discussions, think aloud exercises, field observation, ethnographic studies, etc.), which may be in the forms of qualitative or quantitative research and which may be further categorized according to their objectives as follows: Empirical Studies for Evaluation: studies for assessing the effectiveness and usability of specific VIS techniques, tools, systems, and workflows, for collecting lessons learned from failures, and for establishing the best practice. Empirical Studies for Observation, Data Acquisition, and Hypothesis Formulation: studies for observing phenomena in visualization processes, stimulating hypothesis formulation, and collecting data to inform computational models and quality metrics. Empirical Studies for Understanding and Theory Validation: studies for understanding the human factors in visualization processes, including perceptual factors (e.g., visual and nonvisual sensory processes, perception, attention, etc.) and cognitive factors (e.g., memory, learning, reasoning, decision-making, problem-solving, knowledge, emotion, etc.)",1,Concept Formulation,Paper,What Do We Talk About When We Talk About Dashboards?,"Dashboards are one of the most common use cases for data visualization, and their design and contexts of use areconsiderably different from exploratory visualization tools. In this paper, we look at the broad scope of how dashboards are usedin practice through an analysis of dashboard examples and documentation about their use. We systematically review the literaturesurrounding dashboard use, construct a design space for dashboards, and identify major dashboard types. We characterize dashboardsby their design goals, levels of interaction, and the practices around them. Our framework and literature review suggest a number offruitful research directions to better support dashboard design, implementation, and use.",https://alper.datav.is/assets/publications/dashboards/dashboards-preprint.pdf1,Model Development,Paper,A Model of Spatial Directness in Interactive Visualization.,"We discuss the concept of directness in the context of spatial interaction with visualization. In particular, we propose amodel that allows practitioners to analyze and describe the spatial directness of interaction techniques, ultimately to be able to betterunderstand interaction issues that may affect usability. To reach these goals, we distinguish between different types of directness.Each type of directness depends on a particular mapping between different spaces, for which we consider the data space, thevisualization space, the output space, the user space, the manipulation space, and the interaction space. In addition to the introductionof the model itself, we also show how to apply it to several real-world interaction scenarios in visualization, and thus discuss theresulting types of spatial directness, without recommending either more direct or more indirect interaction techniques. In particular, wewill demonstrate descriptive and evaluative usage of the proposed model, and also briefly discuss its generative usage.",https://ieeexplore-ieee-org.myaccess.library.utoronto.ca/stamp/stamp.jsp?tp=&arnumber=83950681,Mathematical Formalization,Paper,An Algebraic Process for Visualization Design,"We present a model of visualization design based on algebraic considerations of the visualization process. The modelhelps characterize visual encodings, guide their design, evaluate their effectiveness, and highlight their shortcomings. The model hasthree components: the underlying mathematical structure of the data or object being visualized, the concrete representation of the datain a computer, and (to the extent possible) a mathematical description of how humans perceive the visualization. Because we believethe value of our model lies in its practical application, we propose three general principles for good visualization design. We workthrough a collection of examples where our model helps explain the known properties of existing visualizations methods, both goodand not-so-good, as well as suggesting some novel methods. We describe how to use the model alongside experimental user studies,since it can help frame experiment outcomes in an actionable manner. Exploring the implications and applications of our model and itsdesign principles should provide many directions for future visualization research.",http://vis.cs.ucdavis.edu/vis2014papers/TVCG/papers/2181_20tvcg12-kindlmann-2346325.pdf1,Research Methodology,Paper,The elicitation interview technique: capturing people’s experiences of data representations,"Information visualization has become a popular tool to facilitate sense-making, discovery and communication in a large range of professional and casual contexts. However, evaluating visualizations is still a challenge. In particular, we lack techniques to help understand how visualizations are experienced by people. In this paper we discuss the potential of the Elicitation Interview technique to be applied in the context of visualization. The Elicitation Interview is a method for gathering detailed and precise accounts of human experience. We argue that it can be applied to help understand how people experience and interpret visualizations as part of exploration and data analysis processes. We describe the key characteristics of this interview technique and present a study we conducted to exemplify how it can be applied to evaluate data representations. Our study illustrates the types of insights this technique can bring to the fore, for example, evidence for deep interpretation of visual representations and the formation of interpretations and stories beyond the represented data. We discuss general visualization evaluation scenarios where the Elicitation Interview technique may be beneficial and specify what needs to be considered when applying this technique in a visualization context specifically.",https://ieeexplore-ieee-org.myaccess.library.utoronto.ca/document/73699911,Empirical Studies,Paper,Hairy Slices: Evaluating the Perceptual Effectiveness of Cutting Plane Glyphs for 3D Vector Fields,"Three-dimensional vector fields are common datasets throughout the sciences. Visualizing these fields is inherently difficult due to issues such as visual clutter and self-occlusion. Cutting planes are often used to overcome these issues by presenting more manageable slices of data. The existing literature provides many techniques for visualizing the flow through these cutting planes; however, there is a lack of empirical studies focused on the underlying perceptual cues that make popular techniques successful. This paper presents a quantitative human factors study that evaluates static monoscopic depth and orientation cues in the context of cutting plane glyph designs for exploring and analyzing 3D flow fields. The goal of the study was to ascertain the relative effectiveness of various techniques for portraying the direction of flow through a cutting plane at a given point, and to identify the visual cues and combinations of cues involved, and how they contribute to accurate performance. It was found that increasing the dimensionality of line-based glyphs into tubular structures enhances their ability to convey orientation through shading, and that increasing their diameter intensifies this effect. These tube-based glyphs were also less sensitive to visual clutter issues at higher densities. Adding shadows to lines was also found to increase perception of flow direction. Implications of the experimental results are discussed and extrapolated into a number of guidelines for designing more perceptually effective glyphs for 3D vector field visualizations.",https://europepmc.org/article/MED/278752121,Empirical Studies,Paper,Familiarity Vs Trust: A Comparative Study of Domain Scientists’ Trust in Visual Analytics and Conventional Analysis Methods,"Combining interactive visualization with automated analytical methods like statistics and data mining facilitates data-driven discovery. These visual analytic methods are beginning to be instantiated within mixed-initiative systems, where humans and machines collaboratively influence evidence-gathering and decision-making. But an open research question is that, when domain experts analyze their data, can they completely trust the outputs and operations on the machine-side? Visualization potentially leads to a transparent analysis process, but do domain experts always trust what they see? To address these questions, we present results from the design and evaluation of a mixed-initiative, visual analytics system for biologists, focusing on analyzing the relationships between familiarity of an analysis medium and domain experts' trust. We propose a trust-augmented design of the visual analytics system, that explicitly takes into account domain-specific tasks, conventions, and preferences. For evaluating the system, we present the results of a controlled user study with 34 biologists where we compare the variation of the level of trust across conventional and visual analytic mediums and explore the influence of familiarity and task complexity on trust. We find that despite being unfamiliar with a visual analytic medium, scientists seem to have an average level of trust that is comparable with the same in conventional analysis medium. In fact, for complex sense-making tasks, we find that the visual analytic system is able to inspire greater trust than other mediums. We summarize the implications of our findings with directions for future research on trustworthiness of visual analytic systems.",https://ieeexplore.ieee.org/document/75361061,Empirical Studies,Paper,Modeling Color Difference for Visualization Design,"Color is frequently used to encode values in visualizations. For color encodings to be effective, the mapping between colors and values must preserve important differences in the data. However, most guidelines for effective color choice in visualization are based on either color perceptions measured using large, uniform fields in optimal viewing environments or on qualitative intuitions. These limitations may cause data misinterpretation in visualizations, which frequently use small, elongated marks. Our goal is to develop quantitative metrics to help people use color more effectively in visualizations. We present a series of crowdsourced studies measuring color difference perceptions for three common mark types: points, bars, and lines. Our results indicate that peoples' abilities to perceive color differences varies significantly across mark types. Probabilistic models constructed from the resulting data can provide objective guidance for designers, allowing them to anticipate viewer perceptions in order to inform effective encoding design.",https://pubmed.ncbi.nlm.nih.gov/28866544/2,Area 2,Description,,"This area encompasses all forms of application-focused research, which may aim to solve an application-motivated technical problem, to formulate the best practice in working with domain experts to transform general-purpose visualization technology to domain-specific solutions, to design and develop visualization systems and visual analytics workflows for supporting individual applications, or to gain insight into how to adapt and optimize visualization technology to support the users in a particular application domain. The technical solutions reported in this area are mostly application-specific and usually developed in collaboration with domain experts. These solutions can be in different forms, such as designs of visual representations and interaction techniques, descriptions of algorithms and techniques for data transformation, prototypes of visualization hardware and software, specifications of workflows and best practice, or design studies. Application papers underline the impact and importance of the field beyond the VIS research community itself.",2,Domains,Description,,"The use of visualization and visual analytics spreads across essentially all areas research and is relevant to commercial entities as well as non-profit and governmental agencies. In some areas the use has reached a high level of maturity whereas in other domains visualization is emerging as a new and essential component in the workflow. VIS welcomes submissions related to application domains spanning all existing, emerging and potential domains.",2,Technical Solution,Description,,"visual representations, interaction techniques, algorithms, techniques, hardware prototypes, software prototypes, integrated workflows, recommended working practice, etc.",2,Insight,Description,,"success stories and failures about applying visualization technology in practice, achievements of multidisciplinary research projects, benefits gained from collaboration with domain experts, and guidelines resulting from application-focused design studies.",2,Domains,Paper,Visual Analysis and Dissemination of Scientific Literature Collections with SurVis,"Bibliographic data such as collections of scientific articles and citation networks have been studied extensively in information visualization and visual analytics research. Powerful systems have been built to support various types of bibliographic analysis, but they require some training and cannot be used to disseminate the insights gained. In contrast, we focused on developing a more accessible visual analytics system, called SurVis, that is ready to disseminate a carefully surveyed literature collection. The authors of a survey may use our Web-based system to structure and analyze their literature database. Later, readers of the survey can obtain an overview, quickly retrieve specific publications, and reproduce or extend the original bibliographic analysis. Our system employs a set of selectors that enable users to filter and browse the literature collection as well as to control interactive visualizations. The versatile selector concept includes selectors for textual search, filtering by keywords and meta-information, selection and clustering of similar publications, and following citation links. Agreement to the selector is represented by word-sized sparkline visualizations seamlessly integrated into the user interface. Based on an analysis of the analytical reasoning process, we derived requirements for the system. We developed the system in a formative way involving other researchers writing literature surveys. A questionnaire study with 14 visual analytics experts confirms that SurVis meets the initially formulated requirements.",https://pubmed.ncbi.nlm.nih.gov/26529698/2,Domains,Paper,Lineage: Visualizing multivariate clinical data in genealogy graphs,"The majority of diseases that are a significant challenge for public and individual heath are caused by a combination of hereditary and environmental factors. In this paper we introduce Lineage, a novel visual analysis tool designed to support domain experts who study such multifactorial diseases in the context of genealogies. Incorporating familial relationships between cases with other data can provide insights into shared genomic variants and shared environmental exposures that may be implicated in such diseases. We introduce a data and task abstraction, and argue that the problem of analyzing such diseases based on genealogical, clinical, and genetic data can be mapped to a multivariate graph visualization problem. The main contribution of our design study is a novel visual representation for tree-like, multivariate graphs, which we apply to genealogies and clinical data about the individuals in these families. We introduce data-driven aggregation methods to scale to multiple families. By designing the genealogy graph layout to align with a tabular view, we are able to incorporate extensive, multivariate attributes in the analysis of the genealogy without cluttering the graph. We validate our designs by conducting case studies with our domain collaborators.",https://vdl.sci.utah.edu/publications/2018_tvcg_lineage/2,Domains,Paper,In Situ Distribution Guided Analysis and Visualization of Transonic Jet Engine Simulations,"Study of flow instability in turbine engine compressors is crucial to understand the inception and evolution of engine stall. Aerodynamics experts have been working on detecting the early signs of stall in order to devise novel stall suppression technologies. A state-of-the-art Navier-Stokes based, time-accurate computational fluid dynamics simulator, TURBO, has been developed in NASA to enhance the understanding of flow phenomena undergoing rotating stall. Despite the proven high modeling accuracy of TURBO, the excessive simulation data prohibits post-hoc analysis in both storage and I/O time. To address these issues and allow the expert to perform scalable stall analysis, we have designed an in situ distribution guided stall analysis technique. Our method summarizes statistics of important properties of the simulation data in situ using a probabilistic data modeling scheme. This data summarization enables statistical anomaly detection for flow instability in post analysis, which reveals the spatiotemporal trends of rotating stall for the expert to conceive new hypotheses. Furthermore, the verification of the hypotheses and exploratory visualization using the summarized data are realized using probabilistic visualization techniques such as uncertain isocontouring. Positive feedback from the domain scientist has indicated the efficacy of our system in exploratory stall analysis.",https://pubmed.ncbi.nlm.nih.gov/27875195/2,Technical Solution,Paper,HiPiler: Visual Exploration of Large Genome Interaction Matrices with Interactive Small Multiples,"This paper presents an interactive visualization interface-HiPiler-for the exploration and visualization of regions-of-interest in large genome interaction matrices. Genome interaction matrices approximate the physical distance of pairs of regions on the genome to each other and can contain up to 3 million rows and columns with many sparse regions. Regions of interest (ROIs) can be defined, e.g., by sets of adjacent rows and columns, or by specific visual patterns in the matrix. However, traditional matrix aggregation or pan-and-zoom interfaces fail in supporting search, inspection, and comparison of ROIs in such large matrices. In HiPiler, ROIs are first-class objects, represented as thumbnail-like ""snippets"". Snippets can be interactively explored and grouped or laid out automatically in scatterplots, or through dimension reduction methods. Snippets are linked to the entire navigable genome interaction matrix through brushing and linking. The design of HiPiler is based on a series of semi-structured interviews with 10 domain experts involved in the analysis and interpretation of genome interaction matrices. We describe six exploration tasks that are crucial for analysis of interaction matrices and demonstrate how HiPiler supports these tasks. We report on a user study with a series of data exploration sessions with domain experts to assess the usability of HiPiler as well as to demonstrate respective findings in the data.",https://pubmed.ncbi.nlm.nih.gov/28866592/2,Technical Solution,Paper,Globe Browsing: Contextualized Spatio-Temporal Planetary Surface Visualization,"Results of planetary mapping are often shared openly for use in scientific research and mission planning. In its raw format, however, the data is not accessible to non-experts due to the difficulty in grasping the context and the intricate acquisition process. We present work on tailoring and integration of multiple data processing and visualization methods to interactively contextualize geospatial surface data of celestial bodies for use in science communication. As our approach handles dynamic data sources, streamed from online repositories, we are significantly shortening the time between discovery and dissemination of data and results. We describe the image acquisition pipeline, the pre-processing steps to derive a 2.5D terrain, and a chunked level-of-detail, out-of-core rendering approach to enable interactive exploration of global maps and high-resolution digital terrain models. The results are demonstrated for three different celestial bodies. The first case addresses high-resolution map data on the surface of Mars. A second case is showing dynamic processes, such as concurrent weather conditions on Earth that require temporal datasets. As a final example we use data from the New Horizons spacecraft which acquired images during a single flyby of Pluto. We visualize the acquisition process as well as the resulting surface data. Our work has been implemented in the OpenSpace software [8], which enables interactive presentations in a range of environments such as immersive dome theaters, interactive touch tables, and virtual reality headsets.",https://pubmed.ncbi.nlm.nih.gov/28866505/2,Insight,Paper,Activity-Centered Domain Characterization for Problem-Driven Scientific Visualization,"Although visualization design models exist in the literature in the form of higher-level methodological frameworks, these models do not present a clear methodological prescription for the domain characterization step. This work presents a framework and end-to-end model for requirements engineering in problem-driven visualization application design. The framework and model are based on the activity-centered design paradigm, which is an enhancement of human-centered design. The proposed activity-centered approach focuses on user tasks and activities, and allows an explicit link between the requirements engineering process with the abstraction stage-and its evaluation-of existing, higher-level visualization design models. In a departure from existing visualization design models, the resulting model: assigns value to a visualization based on user activities; ranks user tasks before the user data; partitions requirements in activity-related capabilities and nonfunctional characteristics and constraints; and explicitly incorporates the user workflows into the requirements process. A further merit of this model is its explicit integration of functional specifications, a concept this work adapts from the software engineering literature, into the visualization design nested model. A quantitative evaluation using two sets of interdisciplinary projects supports the merits of the activity-centered model. The result is a practical roadmap to the domain characterization step of visualization design for problem-driven data visualization. Following this domain characterization model can help remove a number of pitfalls that have been identified multiple times in the visualization design literature.",https://pubmed.ncbi.nlm.nih.gov/28866550/